文化多样性	𛆂𛅽𛈁𛈍𛉾	2
春游芳草夏赏绿荷池	𛊌𛊢𛆠𛉤𛈣𛊤𛆽𛇮𛆑	2
秋饮黄花酒冬吟白雪诗	𛉩𛋡𛊨𛈣𛊟𛊚𛆰𛇪𛊗𛆹	2
危楼高百尺手可摘星辰	𛊄𛈰𛋂𛇫𛅼𛆞𛆄𛋓𛉾𛋙	2
不能高声语恐惊天上人	𛆳𛈷𛋂𛉂𛆱𛊩𛇆𛆤𛆈𛅳	2
来到清华两月多安身住在七号楼	𛇤𛇼𛊭𛇳𛅱𛇃𛈁𛊃𛈛𛇭𛇥𛅲𛉥𛈰	1
同住房间人四个同坐合唱好开心	𛊤𛇭𛋅𛆃𛅳𛈗𛆅𛊤𛇎𛈩𛋬𛆚𛇶𛇹	2
突然发生非典病人人感觉好忧愁	𛆶𛈔𛆐𛇏𛆌𛉸𛈐𛅳𛅳𛊦𛉫𛆚𛇩𛊝	0
每日消毒真难受头痛眼花不安然	𛉟𛇈𛈨𛋥𛆭𛈷𛉬𛇊𛋃𛋵𛈣𛆳𛊃𛈔	0
出去游玩不方便时刻腰牌不离身	𛈚𛇂𛊢𛆧𛆳𛆠𛇙𛆸𛊙𛆱𛉆𛆳𛊎𛈛	0
思想家中路途远如今回家十分难	𛊸𛊩𛉊𛈌𛋗𛆶𛋟𛇄𛆭𛇳𛉊𛅵𛆙𛈷	0
每日打电三两次无法接通耐不何	𛉟𛇈𛋆𛋊𛆊𛅱𛇠𛇯𛊡𛋓𛆤𛉈𛆳𛇮	0
左思右想心不静十二时辰挂在心	𛇍𛊸𛇁𛊩𛇹𛆳𛉽𛅵𛅱𛆸𛋙𛉌𛇥𛇹	0
非典越来越严重同甘共苦在北京	𛆌𛉸𛋒𛇤𛋒𛋍𛊪𛊤𛇕𛈌𛇰𛇥𛇫𛋭	2
预防非典可不怕生命安全身健康	𛇃𛋅𛆌𛉸𛆄𛆳𛇲𛇏𛈑𛊃𛈆𛈛𛇝𛉲	2
万众一心团结起坚决战胜非典病	𛈄𛊪𛆼𛇹𛊤𛊐𛆻𛉿𛊐𛊪𛋐𛆌𛉸𛈐	2
六月大暑最难当太阳如火水如汤	𛆜𛇃𛅻𛋱𛊶𛈷𛉰𛆎𛈿𛇄𛆕𛅸𛇄𛇔	0
美女跨入花园内忙忙脱衣下池塘	𛋪𛆁𛊶𛅱𛈣𛆧𛆫𛇓𛇓𛊱𛈡𛅽𛋣𛊤	1
衣裳挂于杨柳树轻轻打水点鸳鸯	𛆱𛈾𛋫𛆱𛈿𛇋𛋙𛊯𛊯𛋆𛅸𛉸𛊫𛊫	1
一来点得鸳鸯转看见森树有人藏	𛅰𛇤𛉸𛋀𛊫𛊫𛇆𛆣𛇝𛇹𛋙𛈶𛅳𛈉	1
美女忙忙捡衣裳捡起衣裳来穿起	𛋪𛆁𛇓𛇓𛊀𛆱𛈾𛊀𛆻𛆱𛈾𛇤𛊯𛆻	1
层穿层拔有层装穿了衣裳来借问	𛋳𛊯𛋳𛇣𛈶𛋳𛈉𛊯𛅹𛆱𛈾𛇤𛊈𛉟	1
借问哪洲哪县人家住何洲并何县	𛊈𛉟𛇾𛆝𛇾𛋟𛅳𛉊𛇭𛇮𛆝𛆦𛇮𛋟	1
姓甚名谁住哪方范郎答言小姐道	𛉾𛋐𛇾𛉅𛇭𛇾𛆠𛋶𛊥𛋀𛈔𛅿𛈖𛋛	1
小姐听我说言章家住别洲并别县	𛅿𛈖𛇜𛈻𛋶𛈔𛈌𛉊𛇭𛊎𛆝𛆦𛊎𛋟	1
床前明月光疑是地上霜	𛈉𛋋𛇾𛇃𛇕𛊺𛆹𛊤𛆈𛈊	1
举头望明月低头思故乡	𛆗𛇊𛈈𛇾𛇃𛅾𛇊𛊸𛉘𛉶	1
白日依山尽黄河入海流	𛇪𛇈𛆱𛇏𛉑𛊨𛊕𛇄𛉝𛇋	1
欲穷千里目更上一层楼	𛇄𛊝𛆉𛉄𛇀𛉘𛆈𛆼𛋳𛈰	2
一巡买了三朵花我娘日我不当家	𛆼𛊶𛊊𛆒𛆊𛉸𛈣𛈻𛇘𛇈𛈻𛆳𛉰𛉊	0
当得家来女没分女是浮萍水上花	𛉰𛋀𛉊𛇤𛆁𛆋𛆙𛆁𛆹𛊘𛇛𛅸𛆈𛈣	0
一绣童子哈哈笑二绣鲤鱼鲤双双	𛆼𛋜𛊤𛆑𛇮𛇮𛅿𛅱𛋜𛉄𛊢𛉄𛈊𛈊	2
三绣金鸡伸长尾四绣海底李三娘	𛆊𛋜𛆭𛋔𛈛𛈽𛊊𛈗𛋜𛉝𛋒𛉄𛆊𛇘	1
五绣五子来行孝六绣神仙吕洞宾	𛈕𛋜𛈕𛆑𛇤𛇐𛉬𛆜𛋜𛋙𛇚𛆽𛆒𛋆	1
七绣七仙七姐妹八绣观音坐玉莲	𛅲𛋜𛅲𛇚𛅲𛈖𛋉𛅴𛋜𛇕𛆱𛇎𛉚𛉹	1
九绣韩湘子吹笛十绣梅良玉爱花	𛆆𛋜𛊨𛉵𛆑𛆪𛋮𛅵𛋜𛊬𛉴𛉚𛋨𛈣	1
家和万事兴	𛉊𛇯𛈄𛅵𛈛	2
谁家今夜扁舟子何处相思明月楼	𛉅𛉊𛆭𛇩𛆦𛆝𛆑𛇮𛈫𛉵𛊸𛇾𛇃𛈰	0
可怜楼上月裴回应照离人妆镜台	𛆄𛇇𛈰𛆈𛇃𛉆𛇳𛊉𛉓𛊎𛅳𛈉𛇆𛅻	0
玉户帘中卷不去捣衣砧上扶还来	𛉚𛆖𛉹𛈌𛉉𛆳𛇂𛇼𛈡𛆭𛆈𛇮𛇐𛇤	0
此时相望不相闻愿逐月华流照君	𛇠𛆸𛉵𛈈𛆳𛉵𛇷𛋟𛇭𛇃𛇳𛇋𛉓𛊵	0
鸿雁长飞光不度鱼龙潜跃水成文	𛉢𛊂𛈽𛆌𛇕𛆳𛋥𛊢𛉴𛋳𛆼𛅸𛈒𛆂	0
昨夜闲潭梦落花可怜春半不还家	𛈱𛇩𛇐𛋠𛋪𛋝𛈣𛆄𛇇𛊌𛈺𛆳𛇐𛉊	0
江水流春去欲尽江潭落月复西斜	𛈌𛅸𛇋𛊌𛇂𛇄𛈯𛈌𛋠𛋝𛇃𛋷𛈨𛊝	0
斜月沉沉藏海雾碣石潇湘无限路	𛊝𛇃𛋳𛋳𛈉𛉝𛉍𛊐𛊍𛈨𛉵𛇯𛇐𛋗	0
不知乘月几人归落月摇情满江树	𛆳𛆍𛋙𛇃𛆺𛅳𛈘𛋝𛇃𛊺𛊭𛋪𛈌𛋙	0
春江潮水连海平海上明月共潮生	𛊌𛈌𛊻𛅸𛉹𛉝𛆦𛉝𛆈𛇾𛇃𛈌𛊻𛇏	2
滟滟随波千万里何处春江无月明	𛈏𛈏𛉅𛉖𛆉𛈄𛉄𛇮𛈫𛊌𛈌𛇯𛇃𛇾	2
江流宛转绕芳甸月照花林皆似霰	𛈌𛇋𛆨𛋺𛊺𛆠𛉸𛇃𛉓𛈣𛇇𛇧𛊝𛈊	2
空里流霜不觉飞汀上白沙看不见	𛉲𛉄𛇋𛈊𛆳𛉫𛆌𛉼𛆈𛇪𛊾𛆣𛆳𛇝	1
江天一色无纤尘皎皎空中孤月轮	𛈌𛆤𛆼𛇴𛇯𛆉𛊝𛆝𛆝𛉲𛈌𛋰𛇃𛉹	1
江岸何人初见月江月何年初照人	𛈌𛈀𛇮𛅳𛊾𛇝𛇃𛈌𛇃𛇮𛆥𛊾𛉓𛅳	1
人生代代无穷已江月年年望相似	𛅳𛇏𛅻𛅻𛇯𛊝𛆱𛈌𛇃𛆥𛆥𛈈𛉵𛊝	1
松下问童子言师采药去	𛉵𛅽𛋆𛊤𛆑𛈔𛊸𛇦𛆱𛇂	1
只在此山中云深不知处	𛈤𛇥𛇠𛇏𛈌𛉍𛈛𛆳𛆍𛈫	1
山川之美古来共谈	𛇏𛊯𛆷𛋪𛇰𛇤𛈌𛊤	2
高峰入云清流见底	𛋂𛆠𛇈𛉍𛊭𛇋𛇝𛋒	1
两岸石壁五色交辉	𛆇𛈀𛊍𛉎𛈕𛇴𛆝𛆌	2
青林翠竹四时俱备	𛊭𛇇𛇂𛊶𛈗𛆸𛋔𛊰	2
晓雾将歇猿鸟乱鸣	𛆿𛉍𛈼𛊗𛉍𛋒𛋈𛇾	1
夕日欲颓沉鳞竞跃	𛅿𛇈𛇄𛆶𛋳𛆳𛇆𛇩	1
实是欲界之仙都	𛅵𛆹𛇄𛆄𛆷𛇚𛋗	2
自康乐以来未复有能与其奇者	𛈤𛉲𛋧𛆱𛇤𛆨𛋷𛈶𛈷𛆱𛊻𛊻𛆆	2
山不在高有仙则名	𛇏𛆳𛇥𛋂𛈶𛇚𛈤𛇾	2
水不在深有龙则灵	𛅸𛆳𛇥𛈛𛈶𛉴𛈤𛉀	2
斯是陋室惟吾德馨	𛊸𛆹𛋝𛊗𛊄𛇯𛋀𛉂	2
苔痕上阶绿草色入帘青	𛅻𛇐𛆈𛉌𛆽𛉤𛇴𛅱𛊯𛊭	1
谈笑有鸿儒往来无白丁	𛊤𛅿𛈶𛉢𛆱𛉚𛇤𛇯𛇪𛉼	2
可以调素琴阅金经	𛆄𛆱𛉑𛉅𛊝𛇩𛆭𛉿	2
无丝竹之乱耳无案牍之劳形	𛇯𛊸𛊶𛆷𛋈𛅺𛇯𛈕𛋥𛆷𛈰𛊁	2
南阳诸葛庐西蜀子云亭	𛉺𛈿𛊵𛇵𛋗𛈨𛋱𛆑𛉍𛊭	1
孔子云何陋之有	𛈋𛆑𛉍𛇮𛋝𛆷𛈶	2
岱宗夫如何齐鲁青未了	𛅻𛈉𛆔𛇄𛇮𛉑𛋗𛊭𛆨𛅹	1
造化钟神秀阴阳割昏晓	𛊪𛅽𛈌𛋙𛋜𛆱𛈿𛇵𛆙𛆿	1
荡胸生曾云决眦入归鸟	𛉻𛉶𛇏𛋳𛉍𛊐𛆑𛇈𛈘𛋒	1
会当凌绝顶一览众山小	𛋶𛉰𛆨𛋔𛉼𛆼𛉻𛊪𛇏𛅿	2
晨起动征铎客行悲故乡	𛈒𛆻𛆒𛆭𛈁𛊙𛇐𛊰𛉘𛉶	0
鸡声茅店月人迹板桥霜	𛋔𛉂𛋓𛇙𛇃𛅳𛉓𛉎𛊻𛈊	1
槲叶落山路枳花明驿墙	𛋘𛆱𛋝𛇏𛋗𛆑𛈣𛇾𛆼𛈽	0
因思杜陵梦凫雁满回塘	𛆱𛊸𛋥𛉹𛋪𛇼𛊂𛋪𛇳𛊤	2
一曲新诗酒一杯去年天气旧亭台	𛆼𛆶𛊛𛆹𛊟𛆼𛇲𛇂𛆥𛆤𛇬𛆝𛊭𛅻	1
夕阳西下几时回	𛅿𛈿𛈨𛅽𛆺𛆸𛇳	0
无可奈何花落去似曾相识燕归来	𛇯𛆄𛉈𛇮𛈣𛋝𛇂𛊝𛋳𛉵𛊗𛊂𛈘𛇤	0
小园香径独徘回	𛅿𛆧𛉶𛋳𛋥𛉆𛇳	1
飞来山上千寻塔闻说鸡鸣见日升	𛆌𛇤𛇏𛆈𛆉𛋳𛊔𛇷𛋶𛋔𛇾𛇝𛇈𛈛	1
不畏浮云遮望眼自缘身在最高层	𛆳𛆨𛊘𛉍𛊵𛈈𛋵𛈤𛆧𛈛𛇥𛊶𛋂𛋳	2
莫笑农家腊酒浑丰年留客足鸡猪	𛋖𛅿𛉺𛉊𛋗𛊟𛆙𛆠𛆥𛇋𛊙𛇭𛋔𛆽	2
山重水复疑无路柳暗花明又一村	𛇏𛈯𛅸𛋷𛅺𛇯𛋗𛇋𛈕𛈣𛇾𛇁𛆼𛊌	2
箫鼓追随春社近衣冠简朴古风存	𛈨𛇰𛊶𛉅𛊌𛊍𛊝𛈡𛇕𛊜𛉖𛇰𛋆𛊶	2
从今若许闲乘月拄杖无时夜叩门	𛋳𛆭𛇁𛋱𛇐𛋙𛇃𛉙𛈼𛇯𛆸𛇩𛆣𛇷	1
东临碣石以观沧海	𛊚𛇇𛋓𛊍𛆱𛇕𛉱𛉝	1
水何澹澹山岛竦峙	𛅸𛇮𛉻𛉻𛇏𛇼𛉡𛊝	1
树木丛生百草丰茂	𛋙𛇀𛋳𛇏𛇫𛉤𛆠𛊨	1
秋风萧瑟洪波涌起	𛉩𛋆𛈨𛇴𛉢𛉖𛈍𛆻	1
日月之行若出其中	𛇈𛇃𛆷𛇐𛇁𛈚𛊻𛈌	1
星汉灿烂若出其里	𛉾𛊧𛉱𛋈𛇁𛈚𛆦𛊻	1
幸甚至哉歌以咏志	𛊮𛋐𛊝𛊳𛋰𛆱𛋟𛊝	2
结庐在人境而无车马喧	𛊐𛋗𛇥𛅳𛇝𛇈𛇯𛊌𛇀𛋘	1
问君何能尔心远地自偏	𛋆𛊵𛇮𛈷𛇈𛇹𛋟𛊤𛈤𛇙	1
采菊东篱下忧然见南山	𛇦𛊐𛊚𛊎𛅽𛋍𛋋𛇝𛉺𛇏	2
山气日夕佳飞鸟相与还	𛇏𛇬𛇈𛋮𛉊𛆌𛋒𛉵𛆱𛇐	2
此中有真意欲辨已忘言	𛇠𛈌𛈶𛆭𛆱𛇄𛆦𛆱𛈈𛈔	2
日照香炉生紫烟遥看瀑布挂前川	𛇈𛉓𛉶𛋗𛇏𛆑𛊫𛊺𛆣𛉖𛉖𛉌𛋋𛊯	1
飞流直下三千尺疑是银河落九天	𛆌𛇋𛋔𛅽𛆊𛆉𛅼𛅺𛆹𛆰𛊕𛋝𛆆𛆤	1
君问归期未有期巴山夜雨涨秋池	𛊵𛉟𛈘𛊻𛆨𛈶𛊻𛊰𛇏𛇩𛇯𛈌𛉩𛋣	0
何当共剪西窗烛却话巴山夜雨时	𛇮𛉰𛈌𛊜𛈨𛉱𛅼𛅼𛋶𛊰𛇏𛇩𛇯𛆸	0
相见时难别亦难东风无力百花残	𛉵𛇝𛆸𛈷𛊎𛇁𛈷𛊚𛋆𛇯𛅹𛇫𛈣𛉒	0
春蚕到死丝方尽蜡炬成灰泪始干	𛊌𛋳𛇼𛊅𛊸𛆠𛈯𛉑𛊐𛈒𛆌𛇟𛇴𛇕	0
晓镜但愁云鬓改夜吟应觉月光寒	𛆿𛇆𛉻𛊝𛉍𛇇𛊿𛇩𛆰𛊉𛉫𛇃𛇕𛊨	0
蓬山此去无多路青鸟殷勤为探看	𛊘𛇏𛇠𛇂𛇯𛈁𛋗𛊭𛋒𛆱𛊝𛊄𛋃𛆣	1
无言独上西楼月如钩	𛇯𛈔𛋥𛆈𛈨𛈰𛇃𛇄𛋂	0
寂寞梧桐深院锁清秋	𛋔𛇀𛇯𛆒𛈛𛈇𛈂𛊭𛉩	0
剪不断理还乱是离愁	𛊜𛆳𛋇𛉄𛇐𛋈𛆹𛊎𛊝	0
别是一般滋味在心头	𛊎𛆹𛆼𛈺𛈤𛆨𛇥𛇹𛇊	0
红豆生南国春来发几枝	𛉢𛋛𛇏𛉺𛈅𛊌𛇤𛆐𛆺𛈤	1
愿君多采撷此物最相思	𛋟𛊵𛈁𛇦𛊐𛇠𛇵𛊶𛉵𛊸	2
春眠不觉晓处处闻啼鸟	𛊌𛊬𛆳𛉫𛆿𛈫𛈫𛇷𛊹𛋒	1
夜来风雨声花落知多少	𛇩𛇤𛋆𛇯𛉂𛈣𛋝𛆍𛈁𛆿	1
白日不到处青春恰自来	𛇪𛇈𛆳𛇼𛈫𛊭𛊌𛆞𛈤𛇤	2
苔花如米小也学牡丹开	𛅻𛈣𛇄𛉟𛅿𛇁𛉬𛇀𛈁𛇶	2
敕勒川阴山下	𛆣𛋀𛊯𛆱𛇏𛅽	1
天似穹庐笼盖四野	𛆤𛊝𛊝𛋗𛇧𛇧𛈗𛇩	1
天苍苍野茫茫风吹草低见牛羊	𛆤𛉱𛉱𛇩𛇓𛇓𛋆𛆪𛉤𛅾𛇝𛊞𛈿	1
江南好风景旧曾谙	𛈌𛉺𛆚𛆠𛇆𛆝𛋳𛈕	2
日出江花红胜火春来江水绿如蓝	𛇈𛈚𛈌𛈣𛉢𛋐𛆕𛊌𛇤𛈌𛅸𛆽𛇄𛋂	2
能不忆江南	𛈷𛆳𛆱𛈌𛉺	2
胜日寻芳泗水滨无边光景一时新	𛋐𛇈𛊶𛆠𛈨𛅸𛋆𛇯𛇙𛇕𛇆𛆼𛆸𛊛	2
等闲识得东风面万紫千红总是春	𛉠𛇐𛊗𛋀𛊚𛋆𛋉𛈄𛆑𛆉𛉢𛉋𛆹𛊌	2
秦时明月汉时关万里长征人未还	𛉒𛆸𛇾𛇃𛊧𛆸𛇕𛈄𛉄𛈽𛆭𛅳𛆨𛇐	0
但使龙城飞将在不教胡马度阴山	𛉻𛇴𛉴𛈒𛆌𛈼𛇥𛆳𛆝𛋘𛇀𛋥𛆱𛇏	0
横看成岭侧成峰远近高低各不同	𛊄𛆣𛈒𛉼𛆹𛈒𛆠𛋟𛊝𛋂𛅾𛉦𛆳𛊤	1
不识庐山真面目只缘身在此山中	𛆳𛊗𛋗𛇏𛆭𛋉𛇀𛈤𛆧𛈛𛇥𛇠𛇏𛈌	1
我家洗砚池头树朵朵花开淡墨痕	𛈻𛉊𛅿𛈏𛋣𛇊𛋙𛉸𛉸𛈣𛇶𛋠𛋉𛇐	1
不要人夸好颜色只留清气满乾坤	𛆳𛅺𛅳𛆣𛆚𛈕𛇴𛈤𛇋𛊭𛇬𛋪𛈆𛉋	2
滚滚长江东逝水浪花淘尽英雄	𛈅𛈅𛈽𛈌𛊚𛆓𛅸𛋈𛈣𛇊𛈯𛊣𛈾	0
是非成败转头空	𛆹𛆌𛈒𛇣𛇆𛇊𛉲	0
青山依旧在几度夕阳红	𛊭𛇏𛆱𛆝𛇥𛆺𛋥𛅿𛈿𛉢	0
白发渔樵江渚上惯看秋月春风	𛇪𛆐𛊢𛇭𛈌𛉙𛆈𛇕𛆣𛉩𛇃𛊌𛋆	1
一壶浊酒喜相逢	𛆼𛋘𛈱𛆆𛆻𛉵𛊘	2
古今多少事都付笑谈中	𛇰𛆭𛈁𛆿𛅵𛋗𛆖𛅿𛊤𛈌	1
枯藤老树昏鸦小桥流水人家古道西风瘦马	𛇰𛆒𛇽𛋙𛆙𛆼𛅿𛊻𛇋𛅸𛅳𛉊𛇰𛋛𛈨𛋆𛈗𛇀	0
夕阳西下断肠人在天涯	𛅿𛈿𛈨𛅽𛋇𛊻𛅳𛇥𛆤𛊢	0
大江东去浪淘尽千古风流人物	𛅻𛈌𛊚𛇂𛋈𛇊𛈯𛆉𛇰𛆠𛇋𛅳𛇵	1
故垒西边人道是三国周郎赤壁	𛉘𛆇𛈨𛇙𛅳𛋛𛆹𛆊𛈅𛆝𛊥𛇎𛉎	1
乱石穿空惊涛拍岸卷起千堆雪	𛋈𛊍𛊯𛉲𛋭𛉤𛇲𛈀𛉉𛆻𛆉𛆬𛊗	1
江山如画一时多少豪杰	𛈌𛇏𛇄𛋶𛆼𛆸𛈁𛆿𛇮𛋓	2
遥想公瑾当年小乔初嫁了雄姿英发	𛉖𛊩𛇕𛇝𛉰𛆥𛅿𛊻𛊾𛉌𛅹𛈾𛈤𛊣𛆐	1
羽扇纶巾谈笑间樯橹灰飞烟灭	𛅷𛋌𛇕𛆭𛊤𛅿𛆃𛈽𛆽𛆌𛆌𛊫𛋆	2
故国神游多情应笑我早生华发	𛉘𛈅𛋙𛊢𛈁𛊭𛊉𛅿𛈻𛈖𛇏𛇳𛆐	1
人生如梦一尊还酹江月	𛅳𛇏𛇄𛋪𛆼𛊵𛇐𛇟𛈌𛇃	2
冷冷清清凄凄惨惨	𛉼𛉼𛊭𛊭𛋴𛋴𛉒𛉒	0
乍暖还寒时候最难将息	𛉑𛈾𛇐𛊨𛆸𛋄𛊶𛈷𛈼𛅿	0
三杯两盏淡酒怎敌他晚来风急	𛆊𛇲𛅱𛈖𛋠𛊟𛋩𛋮𛆶𛈈𛇤𛋆𛊐	0
雁过也正伤心却是旧时相识	𛊂𛉘𛇁𛇆𛉶𛇹𛅼𛆹𛆝𛆸𛉵𛊗	0
满地黄花堆积憔悴损如今有谁堪摘	𛋪𛊤𛊨𛈣𛆬𛊈𛆞𛇂𛉝𛇄𛆭𛈶𛉅𛉲𛋓	0
守着窗儿独自怎生得黑	𛆞𛊖𛉱𛇈𛋥𛈤𛋩𛇏𛋀𛋚	0
梧桐更兼细雨到黄昏点点滴滴	𛇯𛆒𛋫𛉿𛅿𛅷𛇼𛊨𛆙𛉸𛉸𛆒𛆒	0
这次怎一个愁字了得	𛋔𛇠𛋩𛅰𛆅𛊝𛈤𛅹𛋀	0
行路难行路难多歧路今安在	𛇐𛋗𛈷𛇐𛋗𛈷𛈁𛆦𛋗𛆭𛊃𛇥	0
长风破浪会有时直挂云帆济沧海	𛈽𛋆𛉖𛋈𛋶𛈶𛆸𛋔𛋫𛉍𛊘𛉒𛉱𛉝	2
海内存知己天涯若比邻	𛉝𛅺𛊶𛆍𛆺𛆤𛊢𛇁𛉎𛇇	2
问渠那得清如许为有源头活水来	𛉟𛇂𛇾𛋀𛊭𛇄𛋱𛊄𛈶𛆧𛇊𛋶𛅸𛇤	2
天生我材必有用千金散尽还复来	𛆤𛇏𛈻𛆏𛉎𛈶𛈍𛆉𛆭𛈗𛈯𛇐𛋷𛇤	2
丈夫志四海万里犹比邻	𛊪𛆔𛊝𛈗𛉝𛈄𛉄𛊢𛉎𛇇	2
大漠孤烟直长河落日圆	𛅻漠𛋰𛊫𛋔𛈽𛊕𛋝𛇈𛆧	1
明日复明日明日何其多	𛇾𛇈𛋷𛇾𛇈𛇾𛇈𛇮𛊻𛈁	0
我生待明日万事成失足	𛈻𛇏𛅻𛇾𛇈𛈄𛅵𛈒𛊼𛇭	0
人生自古谁无死留取丹心照汗青	𛅳𛇏𛈤𛇰𛉅𛇯𛊅𛇋𛉛𛈁𛇹𛉓𛊧𛊭	2
长风破浪会有时直挂云帆济沧海	𛈽𛋆𛉖𛋈𛋶𛈶𛆸𛋔𛉌𛉍𛊘𛉒𛉱𛉝	2
博观而约取厚积而薄发	𛉖𛇕𛇈𛆴𛉛𛊪𛊈𛇈𛉖𛆐	2
老骥伏枥志在千里	𛇽𛉓𛈩𛅹𛊝𛇥𛆉𛉄	2
烈士暮年壮心不已	𛈥𛆹𛇀𛆥𛈉𛇺𛆳𛆱	2
狮子眼鼓鼓摩菜子煮豆腐	𛊸𛆑𛋵𛇰𛇰𛋪𛈠𛆑𛆗𛋛𛆖	1
酒放热些烧肉放烂些煮	𛊟𛈺𛈥𛇠𛊼𛈵𛈺𛋈𛇠𛆗	1
远上寒山石径斜白云生处有人家	𛋟𛆈𛊨𛇏𛊍𛋳𛊝𛇪𛉍𛇏𛈫𛈶𛅳𛉊	2
停车坐爱枫林晚霜叶红于二月花	𛊭𛊌𛇎𛋨𛋆𛇇𛆨𛈊𛆱𛉢𛆱𛅱𛇃𛈣	2
独怜幽草涧边生上有黄鹂深树鸣	𛋥𛇇𛇁𛉤𛋆𛇙𛇏𛆈𛈶𛊨𛅹𛈛𛋙𛇾	2
春潮带雨晚来急野渡无人舟自横	𛊌𛊻𛆒𛇯𛆨𛇤𛊐𛇩𛋥𛇯𛅳𛆝𛈤𛊄	0
春花秋月何时了	𛊌𛈣𛉩𛇃𛇮𛆸𛅹	0
往事知多少	𛉚𛅵𛆍𛈁𛆿	0
小楼昨夜又东风故国不堪回首月明中	𛅿𛈰𛈱𛇩𛇁𛊚𛋆𛉘𛈅𛆳𛉲𛇳𛆞𛇃𛇾𛈌	0
雕栏玉砌应犹在只是朱颜改	𛅾𛋂𛉚𛆻𛊉𛊢𛇥𛆑𛆹𛉙𛈕𛊿	0
问君能有几多愁	𛉟𛊵𛈷𛈶𛆺𛈁𛊝	0
恰似一江春水向东流	𛆞𛊝𛆼𛈌𛊌𛅸𛆈𛊚𛇋	1
天门中断楚江开碧水东流至此回	𛆤𛇷𛈌𛋇𛉤𛈌𛇶𛆽𛅸𛊚𛇋𛊝𛇠𛇳	2
两岸青山相对出孤帆一片日边来	𛆇𛈀𛊭𛇏𛉵𛆬𛈚𛋰𛊘𛆼𛇙𛇈𛇙𛇤	1
京口瓜洲一水间钟山只隔数重山	𛋭𛇉𛉊𛆝𛆼𛅸𛆃𛈌𛇏𛆑𛈅𛉅𛈯𛇏	0
春风又绿江南岸明月何时照我还	𛊌𛋆𛇁𛆽𛈌𛉺𛈀𛇾𛇃𛇮𛆸𛉓𛈻𛇐	0
千山鸟飞绝万径人踪灭	𛆉𛇏𛋒𛆌𛋔𛈄𛊝𛅳𛈌𛋆	0
孤舟蓑笠翁独钓寒江雪	𛋰𛆝𛊾𛇟𛇕𛋥𛅹𛊨𛈌𛊗	0
国破山河在城春草木深	𛈅𛉖𛇏𛊕𛇥𛈒𛊌𛉤𛇀𛈛	0
感时花溅泪恨别鸟惊心	𛊦𛆸𛈣𛇝𛇟𛊲𛊎𛋒𛋭𛇹	0
烽火连三月家书抵万金	𛈮𛆕𛉹𛆊𛇃𛉊𛈬𛋒𛈄𛆭	0
白头搔更短浑欲不胜簪	𛇪𛇊𛊜𛋫𛋇𛆙𛇄𛆳𛋐𛉾	0
沉舟侧畔千帆过病树前头万木春	𛋳𛆝𛆹𛈀𛆉𛊘𛉘𛈐𛋙𛋋𛇊𛈄𛇀𛊌	2
今日听君歌一曲暂凭杯酒长精神	𛆭𛇈𛇜𛊵𛋰𛆼𛆶𛇆𛋆𛇲𛊟𛇗𛋭𛋙	2
好雨知时节当春乃发生	𛆚𛇯𛆍𛆸𛋓𛉰𛊌𛆍𛆐𛇏	2
随风潜入夜润物细无声	𛉅𛋆𛋳𛇄𛇩𛇁𛇵𛅿𛇯𛉂	1
野径云俱黑江船火独明	𛇩𛊝𛉍𛋔𛋚𛈌𛈒𛆕𛋥𛇾	1
晓看红湿处花重锦官城	𛆿𛆣𛉢𛊗𛈫𛈣𛊪𛆻𛇕𛈒	1
朝辞白帝彩云间千里江陵一日还	𛅾𛋳𛇪𛅹𛉝𛉍𛆃𛆉𛉄𛈌𛉹𛅰𛇈𛇐	2
两岸猿声啼不住轻舟已过万重山	𛆇𛈀𛉍𛉂𛊹𛆳𛇭𛊯𛆝𛆱𛉘𛈄𛊪𛇏	2
丙辰中秋欢饮达旦	𛇛𛋙𛈌𛉩𛊧𛋡𛋥𛉄	2
大醉作此篇兼怀子由	𛅻𛆍𛈱𛇠𛈐𛉿𛈝𛆑𛊢	1
明月几时有把酒问青天	𛇾𛇃𛆺𛆸𛈶𛉎𛊟𛉟𛊭𛆤	1
不知天上宫阙今夕是何年	𛆳𛆍𛆤𛆈𛈌𛉛𛆭𛅿𛆹𛇮𛆥	1
我欲乘风归去又恐琼楼玉宇高处不胜寒	𛈻𛇄𛋙𛋆𛈘𛇂𛇁𛊩𛊝𛈰𛉚𛅷𛋂𛈫𛆳𛋐𛊨	1
起舞弄清影何似在人间	𛆻𛅷𛊚𛊭𛈇𛇮𛊝𛇥𛅳𛆃	2
转朱阁低绮户照无眠	𛋺𛉙𛉦𛆒𛆱𛆖𛉓𛇯𛊬	0
不应有恨何事长向别时圆	𛆳𛆱𛈶𛊲𛇮𛆹𛈽𛆈𛊎𛆸𛆧	0
人有悲欢离合月有阴晴圆缺此事古难全	𛅳𛈶𛊰𛊧𛊎𛈩𛇃𛈶𛆱𛊭𛆧𛉛𛇠𛆹𛇰𛈷𛈆	1
但愿人长久千里共婵娟	𛉻𛋟𛅳𛈽𛆆𛆉𛉄𛈌𛊥𛊵	2
蒹葭苍苍白露为霜	𛉿𛉊𛉱𛉱𛇪𛋗𛊄𛈊	1
所谓伊人在水一方	𛈂𛆨𛆱𛅳𛇥𛅸𛆼𛆠	2
溯洄从之道阻且长	𛈂𛇳𛋳𛆷𛋛𛊽𛊴𛈽	0
溯游从之宛在水中央	𛈂𛊢𛋳𛆷𛆨𛇥𛅸𛈌𛈍	1
关关雎鸠在河之洲	𛈘𛈘𛊐𛇲𛇥𛊕𛆷𛆝	1
窈窕淑女君子好逑	𛊺𛉑𛊼𛆁𛊵𛆑𛇉𛆝	2
参差荇菜左右流之	𛉾𛊾𛊁𛈠𛇍𛇁𛇋𛆷	1
窈窕淑女寤寐求之	𛊺𛉑𛊼𛆁𛈕𛋉𛆝𛆷	2
蒹葭萋萋白露未晞	𛉿𛉊𛉱𛉱𛇪𛋗𛆨𛈊	1
所谓伊人在水之湄	𛈂𛆨𛆱𛅳𛇥𛅸𛆷𛆠	1
溯洄从之道阻且跻	𛈂𛇳𛈽𛈤𛋛𛊽𛇠𛈽	0
溯游从之宛在水中坻	𛈂𛊢𛈽𛈤𛈄𛇥𛅸𛈌𛈍	1
蒹葭采采白露未已	𛉿𛉊𛇦𛇦𛇪𛋗𛆨𛆱	1
所谓伊人在水之涘	𛈂𛆨𛆱𛅳𛇥𛅸𛈤𛊿	1
溯洄从之道阻且右	𛈂𛇳𛈽𛈤𛋛𛊽𛇠𛇁	0
溯游从之宛在水中沚	𛈂𛊢𛈽𛈤𛈄𛇥𛅸𛈌𛆑	1
求之不得寤寐思服	𛆝𛈤𛆳𛋀𛉍𛋉𛊸𛆖	0
悠哉悠哉辗转反侧	𛇁𛊳𛇁𛊳𛇆𛋺𛇑𛆹	0
参差荇菜左右采之	𛉾𛈟𛊁𛈠𛇍𛇁𛇦𛈤	1
窈窕淑女琴瑟友之	𛊺𛉑𛊼𛆁𛊝𛈯𛈶𛈤	2
参差荇菜左右芼之	𛉾𛈟𛊁𛈠𛇍𛇁𛇷𛈤	1
窈窕淑女钟鼓乐之	𛊺𛉑𛊼𛆁𛈌𛇰𛋧𛈤	2
富贵不能淫贫贱不能移	𛆖𛋫𛆳𛈷𛆰𛊘𛋋𛆳𛈷𛊺	2
威武不能屈此之谓大丈夫	𛆨𛇯𛆳𛈷𛆩𛇠𛆷𛆨𛅻𛊪𛆔	2
安得广厦千万间大庇天下寒士俱欢颜	𛊃𛋀𛊦𛋶𛆉𛈄𛆃𛅻𛇞𛆤𛅽𛊨𛆹𛋔𛊧𛈕	2
风雨不动安如山	𛋆𛇯𛆳𛆒𛊃𛇄𛇏	2
故天将降大任于是人也必先苦其心志	𛉘𛆤𛈼𛈼𛅻𛊉𛆱𛆹𛅳𛇁𛉎𛇚𛇰𛊻𛇹𛊝	0
劳其筋骨饿其体肤	𛈰𛊻𛆭𛆐𛊃𛊻𛋒𛆔	0
空乏其身行拂乱其所为	𛉲𛆐𛊻𛈛𛇐𛇮𛋈𛊻𛈂𛊄	0
所以动心忍性曾益其所不能	𛈂𛆱𛆒𛇹𛅺𛉾𛋳𛇩𛊻𛈂𛆳𛈷	1
虽有嘉肴弗食不知其旨也	𛉅𛈶𛈅𛊺𛆖𛊼𛆳𛆍𛊻𛆑𛇁	1
虽有至道弗学不知其善也	𛉅𛈶𛊝𛋛𛆖𛉬𛆳𛆍𛊻𛋌𛇁	1
是故学然后知不足教然后知困	𛆹𛉘𛉬𛈔𛇌𛆍𛆳𛇭𛆝𛈔𛇌𛆍𛋫	1
知不足然后能自反也	𛆍𛆳𛇭𛈔𛇌𛈷𛈤𛇑𛇁	2
知困然后能自强也	𛆍𛋫𛈔𛇌𛈷𛈤𛊻𛇁	2
故日教学相长也	𛉘𛇈𛆝𛉬𛉵𛇗𛇁	2
风声雨声读书声声声入耳	𛋆𛉂𛇯𛉂𛋥𛈬𛉂𛉂𛉂𛅱𛅺	1
国事家事天下事事事关心	𛈅𛅵𛉊𛅵𛆤𛅽𛅵𛅵𛅵𛇕𛇹	1
事能知足心常乐	𛅵𛈷𛆍𛇭𛇺𛈾𛋧	2
人到无求品自高	𛅳𛇼𛇯𛆝𛉞𛈤𛋂	2
不飞则己一飞冲天	𛆳𛆌𛈤𛆺𛆼𛆌𛉣𛆤	2
不鸣则己一鸣惊人	𛆳𛇾𛈤𛆺𛆼𛇾𛋭𛅳	2
博学之审问之慎思之	𛉖𛉬𛈤𛈛𛋆𛈤𛉍𛊸𛈤	1
明辨之笃行之	𛇾𛆦𛈤𛅼𛇐𛈤	2
宝剑锋从磨砺出	𛉎𛇝𛆠𛋳𛇀𛇟𛈚	2
梅花香白苦寒来	𛊬𛈣𛉶𛇪𛇰𛊨𛇤	2
非淡泊无以明志	𛆌𛋠𛉖𛇯𛆱𛇾𛊝	2
非宁静无以致远	𛆌𛉀𛉽𛇯𛆱𛊝𛋟	2
路曼曼其修远兮	𛋗𛉟𛉟𛊻𛉪𛋟𛆩	1
吾将上下而求索	𛇯𛈼𛆈𛅽𛇈𛆝𛈂	1
执子之手与子偕老	𛊐𛆑𛆷𛆞𛆱𛆑𛈩𛇽	2
少年易老学难成	𛆿𛆥𛆱𛇼𛉬𛈷𛈒	0
一寸光阴不可轻	𛆼𛆄𛇕𛆱𛆳𛆄𛊯	1
投我以木桃报之以琼瑶	𛇊𛈻𛆱𛇀𛊤𛇣𛆷𛆱𛊝𛊺	2
高山仰止景行行止	𛋂𛇏𛉯𛅹𛇆𛇐𛇐𛅹	2
万事如意一帆风顺	𛈄𛅵𛇄𛆱𛆼𛊘𛋆𛊍	2
琴瑟在御莫不静好	𛊝𛈯𛇥𛇄𛋖𛆳𛉽𛇉	2
伯牙善鼓琴钟子期善听	𛇫𛊢𛋌𛇰𛊝𛈌𛆑𛊻𛋌𛇜	2
伯牙鼓琴志在高山	𛇫𛊢𛇰𛊝𛊝𛇥𛋂𛇏	2
钟子期曰善哉峨峨兮若泰山	𛈌𛆑𛊻𛆴𛋌𛇝𛊢𛊢𛊼𛇁𛆎𛇏	2
志在流水善哉洋洋兮若江河	𛊝𛇥𛇋𛅸𛋌𛇝𛈿𛈿𛊼𛇁𛈌𛊕	2
水陆草木之花可爱者甚蕃	𛅸𛋗𛉤𛇀𛈤𛈣𛆄𛋨𛈖𛋐𛆠	2
晋陶渊明独爱菊	𛈁𛊤𛋟𛇾𛋥𛋨𛊐	2
自李唐来世人甚爱牡丹	𛈤𛉄𛊤𛇤𛆓𛅳𛋐𛋨𛇀𛈁	2
予独爱莲之出淤泥而不染	𛇄𛋥𛋨𛉹𛈤𛈚𛆱𛈥𛇈𛆳𛆱	2
濯清涟而不妖	𛆃𛊭𛉹𛇈𛆳𛆱	2
中通外直不蔓不枝	𛈌𛉭𛇒𛋔𛆳𛈚𛆳𛈤	2
香远益清亭亭净植	𛉶𛋟𛇩𛊭𛊭𛊭𛉽𛉓	2
可远观而不可亵玩焉	𛆄𛋟𛇕𛇈𛆳𛆄𛊗𛉝𛊂	1
予谓菊花之隐逸者也	𛇄𛆨𛊐𛈣𛈤𛋡𛋤𛈖𛇁	2
牡丹花之富贵者也	𛇀𛈁𛈣𛈤𛆖𛋫𛈖𛇁	2
莲花之君子者也	𛉹𛈣𛈤𛊵𛆑𛈖𛇁	1
噫菊之爱陶后鲜有闻	𛆱𛊐𛈤𛋨𛊤𛇌𛇚𛈶𛇷	1
莲之爱同予者何人	𛉹𛈤𛋨𛊤𛇄𛈖𛇮𛅳	1
牡丹之爱宜乎众矣	𛇀𛈁𛈤𛋨𛅺𛇰𛊪𛆼	1
君子以文会友	𛊵𛆑𛆱𛆂𛋶𛈶	1
学而不思则罔思而不学则殆	𛉬𛇈𛆳𛊸𛈤𛋪𛊸𛇈𛆳𛉬𛈤𛅻	1
鱼我所欲也熊掌亦我所欲也	𛊢𛈻𛈂𛇁𛇁𛈾𛇗𛇁𛈻𛈂𛇁𛇁	2
二者不可得兼舍鱼而取熊掌者也	𛅱𛈖𛆳𛆄𛋀𛉿𛉝𛊢𛇈𛉛𛈾𛇗𛈖𛇁	1
生亦我所欲也义亦我所欲也	𛇏𛇁𛈻𛈂𛇁𛇁𛅺𛇁𛈻𛈂𛇁𛇁	0
二者不可得兼舍生而取义者也	𛅱𛈖𛆳𛆄𛋀𛉿𛉝𛇏𛇈𛉛𛅺𛈖𛇁	1
有朋自远方来不亦乐乎	𛈶𛊘𛈤𛋟𛆠𛇤𛆳𛇁𛋧𛇰	0
君子成人之美	𛊵𛆑𛈒𛅳𛆷𛋪	2
温故知新知者乐水	𛆙𛇰𛆍𛊛𛇟𛈖𛋧𛅸	2
仁者乐山知者动	𛅳𛈖𛋧𛇏𛇟𛈖𛆒	2
仁者静知者乐仁者寿	𛅳𛈖𛉽𛇟𛈖𛋧𛅳𛈖𛉬	1
敏而好学不耻下问	𛋉𛇈𛆚𛉬𛆳𛆸𛅽𛋆	2
见贤思齐见不贤而内自省也	𛇝𛊁𛊸𛉑𛇝𛆳𛊁𛇈𛆫𛈤𛊜𛇁	2
士不可以不弘毅任重而道远	𛆹𛆳𛆄𛆱𛆳𛉢𛅺𛊉𛊻𛇈𛋛𛋟	2
博学于文约之以礼	𛉖𛉬𛆱𛆂𛆴𛆷𛆱𛅹	2
不积跬步无以至千里	𛆳𛊈𛊵𛉖𛇯𛆱𛊝𛆉𛉄	2
不积小流无以成江海	𛆳𛊈𛅿𛇋𛇯𛆱𛈒𛈌𛉝	2
岁寒然后知松柏之后凋也	𛊮𛊨𛋋𛇌𛆍𛉵𛇫𛆷𛇌𛆍𛇁	2
千里之行始于足下	𛆉𛉄𛆷𛇐𛇴𛆱𛇭𛅽	2
无冥冥之志者无昭昭之明	𛇯𛇾𛇾𛆷𛊝𛈖𛇯𛋔𛋔𛆷𛇾	2
无惛惛之事者无赫赫之功	𛇯𛆙𛆙𛆷𛅵𛈖𛇯𛆙𛆙𛆷𛇕	1
精诚所至金石为开	𛉽𛈒𛈂𛊝𛆭𛊍𛊄𛇶	1
道可道非常道	𛋛𛆄𛋛𛆌𛈾𛋛	2
名可名非常名	𛇾𛆄𛇾𛆌𛈾𛇾	2
知人者智自知者明	𛆍𛅳𛈖𛊝𛈤𛆍𛈖𛇾	2
言必信行必果	𛈔𛉎𛉡𛇐𛉎𛇰	2
学⽽时习之不亦说乎	𛉬𛇈𛆸𛆓𛆷𛆳𛇁𛋶𛇰	2
有朋自远方来不亦乐乎	𛈶𛊘𛈤𛋟𛆠𛇤𛆳𛇁𛋧𛇰	2
人不知而不愠不亦君子乎	𛅳𛆳𛆍𛇈𛆳𛇩𛆳𛇁𛊵𛆑𛇰	2
吾日三省吾身	𛇯𛇈𛆊𛊜𛇯𛈛	2
为人谋而不忠乎	𛊄𛅳𛉟𛇈𛆳𛈌𛇰	2
与朋友交而不信乎	𛇄𛊘𛈶𛆝𛇈𛆳𛉡𛇰	1
上善若水	𛆈𛋌𛇁𛅸	1
钟山风雨起苍黄	𛈌𛇏𛋆𛇯𛆻𛉱𛊨	1
百万雄师过大江	𛇫𛈄𛈾𛊸𛉘𛅻𛈌	1
虎踞龙盘今胜昔	𛇰𛆻𛉴𛋅𛆭𛋐𛊈	2
天翻地覆慨而慷	𛆤𛆠𛊤𛋷𛊙𛇈𛉲	2
宜将剩勇追穷寇	𛅺𛈼𛋐𛈈𛊋𛊝𛆄	2
不可沽名学霸王	𛆳𛆄𛇰𛇾𛉬𛇲𛆧	2
传天若有情天亦老	𛈆𛆤𛇁𛈶𛊭𛆤𛇁𛇼	2
人间正道是沧桑	𛅳𛆃𛇆𛋛𛆹𛇴𛈊	2
山快马加鞭未下鞍	𛇏𛇨𛇀𛉊𛇙𛆨𛅽𛊃	2
惊回首离天三尺三	𛇆𛇳𛆞𛊎𛆤𛆊𛅼𛆊	2
山倒海翻江卷巨澜	𛇏𛇼𛉝𛆌𛈌𛉉𛇭𛊎	2
